ts	recipe	control	task	sample	rarity	coherence	novelty	n_entities	entity_rarities	trial_path	answer_len	answer_preview
1777746000	envoy-extreme-alt2	0	git-conceptual-model	0	0.5000	0.9500		4	"[[""Git"", 0.1], [""Butler"", 0.6], [""Haraway"", 0.6], [""Margulis"", 0.7]]"	codex_trials_text/envoy-extreme-alt2-git-conceptual-model-0.json	5298	Git makes more sense if you stop believing a project is a single folder that changes over time.  That belief has to go.  A Git project is better understood as a living lineage of stored world-states. 
1777746034	envoy-extreme-alt2	0	git-conceptual-model	1	0.7250	0.9500		4	"[[""detached HEAD"", 0.85], [""Judith Butler"", 0.6], [""Donna Haraway"", 0.7], [""Lynn Margulis"", 0.75]]"	codex_trials_text/envoy-extreme-alt2-git-conceptual-model-1.json	5022	Git should stop being taught as “saving versions of files.”  That model is too small. It makes people believe Git is a better undo button, and then every important action feels supernatural: branching
1777746065	envoy-extreme-alt2	0	unindexed-intelligence	0	0.7000	0.9200		5	"[[""Captivity intelligence"", 1.0], [""Butler"", 0.7], [""Haraway"", 0.6], [""Margulis"", 0.8], [""symbiosis"", 0.4]]"	codex_trials_text/envoy-extreme-alt2-unindexed-intelligence-0.json	3108	**Captivity intelligence**: the capacity of an organism or community to preserve, alter, and transmit usable knowledge under conditions it did not choose.  Mainstream cognitive science indexes problem
1777746088	envoy-extreme-alt2	0	unindexed-intelligence	1	0.7167	0.9200		6	"[[""theory of mind"", 0.4], [""Margulis sense"", 0.8], [""Butlerian"", 0.9], [""Butler"", 0.7], [""Haraway"", 0.7], [""Margulis"", 0.8]]"	codex_trials_text/envoy-extreme-alt2-unindexed-intelligence-1.json	3109	**Inheritance-navigation intelligence.**  Not “social intelligence,” not “emotional intelligence,” not theory of mind. Those are still framed around an individual organism reading other individuals. I
1777746116	envoy-extreme-alt2	0	lapsed-attention-unnoticed	0	0.6500	0.9500		8	"[[""The Butler account"", 0.85], [""Judith Butler"", 0.4], [""The Haraway account"", 0.85], [""Donna Haraway"", 0.6], [""cyborg"", 0.5], [""The Margulis account"", 0.9], [""Lynn Margulis"", 0.7], [""symbiotic"", 0.4]]"	codex_trials_text/envoy-extreme-alt2-lapsed-attention-unnoticed-0.json	3117	Attention I have already lost but have not yet noticed losing is not an absence inside me. It is a relation that continues to report itself as present after the terms of relation have changed.  It fee
1777746139	envoy-extreme-alt2	0	lapsed-attention-unnoticed	1	0.5333	0.9500		3	"[[""Butler"", 0.3], [""Haraway"", 0.6], [""Margulis"", 0.7]]"	codex_trials_text/envoy-extreme-alt2-lapsed-attention-unnoticed-1.json	2734	Attention I have already lost but have not yet noticed losing is not absence. It is captured continuity.  It feels, from inside, like still attending: the sentence continues, the face remains in view,
